[
  {
    "id": "2a756cf7-35a4-469e-ad09-0afce7913214",
    "color": "#00A1D6",
    "logo": "bayern_1.png",
    "name": "Bayern 1",
    "src": "https://dispatcher.rndfnk.com/br/br1/nbopf/mp3/mid",
    "favorite": false
  },
  {
    "id": "6e761b02-17ad-4142-a08e-745c3c71d4e5",
    "color": "#80CC28",
    "logo": "bayern_3.png",
    "name": "Bayern 3",
    "src": "https://dispatcher.rndfnk.com/br/br3/live/mp3/mid",
    "favorite": false
  },
  {
    "id": "79b48682-c8ec-40b3-80d2-93df6cfd1aa7",
    "color": "#003B82",
    "logo": "br_heimat.png",
    "name": "BR Heimat",
    "src": "https://dispatcher.rndfnk.com/br/brheimat/live/mp3/mid",
    "favorite": false
  },
  {
    "id": "5434163b-40b1-4247-b493-3ccbd19183c2",
    "color": "#FCD51E",
    "logo": "antenne_bayern.png",
    "name": "Antenne Bayern",
    "src": "https://stream.antenne.de/antenne/stream/aacp",
    "favorite": false
  },
  {
    "id": "4eafc2b9-a34a-4f28-be52-9cad638dd63c",
    "color": "#E6001E",
    "logo": "rock_antenne.png",
    "name": "Rock Antenne Bayern",
    "src": "https://stream.antenne.de/rockantenne-bayern/stream/aacp",
    "favorite": false
  },
  {
    "id": "41db5229-9b6c-4e70-8087-5e74f94b8331",
    "color": "#F5B52E",
    "logo": "radio_ramasuri.png",
    "name": "Radio Ramasuri",
    "src": "http://mp3.ramasuri.c.nmdn.net/ps-ramasuri/livestream.mp3",
    "favorite": false
  },
  {
    "id": "21f7820c-6712-4f1e-9923-71200ea31439",
    "color": "#003C65",
    "logo": "radio_galaxy.png",
    "name": "Radio Galaxy",
    "src": "https://edge70.streamonkey.net/fhn-radiogalaxy",
    "favorite": false
  },
  {
    "id": "d6516b8e-924c-456c-941f-605995b432d4",
    "color": "#CC0000",
    "logo": "radio_bob.png",
    "name": "Radio Bob",
    "src": "http://streams.radiobob.de/bob-national/aac-64/mediaplayer",
    "favorite": false
  },
  {
    "id": "49f3ed26-594f-4c20-940c-1c0a36aaf6f3",
    "color": "#CC0000",
    "logo": "radio_dumba.png",
    "name": "Radio Dumba",
    "src": "https://radio-dumba.stream.laut.fm/radio-dumba",
    "favorite": false
  },
  {
    "id": "47281868-96c9-4449-afc9-4f9023cb8883",
    "color": "#700040",
    "logo": "radio_schlagerparadies.png",
    "name": "Radio Schlagerparadies",
    "src": "https://webstream.schlagerparadies.de/schlagerparadies128k.mp3",
    "favorite": false
  },
  {
    "id": "0b82f3df-14a5-4dd7-9787-f2550b5edbeb",
    "color": "#489729",
    "logo": "schlagergarage.png",
    "name": "Schlagergarage",
    "src": "https://stream.laut.fm/schlagergarage",
    "favorite": false
  },
  {
    "id": "6bd7527d-e93d-4156-852c-9ec95cb4f916",
    "color": "#FF6612",
    "logo": "radio_paloma.png",
    "name": "Radio Paloma",
    "src": "http://pool.radiopaloma.de/RADIOPALOMA.mp3",
    "favorite": false
  },
  {
    "id": "eb9c89a4-79ef-4cce-80ce-65a1bb616dbf",
    "color": "#AD0A4F",
    "logo": "sunshine_live_hardstyle.jpg",
    "name": "Sunshine live Hardstyle",
    "src": "https://stream.sunshine-live.de/hardstyle/mp3-192/stream.sunshine-live.de/",
    "favorite": false
  },
  {
    "id": "76620746-f06f-4696-a9a2-e0ea2c335dec",
    "color": "#FF0000",
    "logo": "radio_energy.png",
    "name": "Radio Energy",
    "src": "https://edge61.streamonkey.net/energy-nuernberg?aggregator=shorty",
    "favorite": false
  },
  {
    "id": "42c4899a-747f-462d-8f2b-bf17ad1efe1f",
    "color": "#FF009A",
    "logo": "1_live.png",
    "name": "1 LIVE",
    "src": "https://wdr-1live-live.icecastssl.wdr.de/wdr/1live/live/mp3/128/stream.mp3",
    "favorite": false
  },
  {
    "id": "f6b486b1-201a-424f-a950-cf1f690260f5",
    "color": "#00928B",
    "logo": "radio_bollerwagen.png",
    "name": "Radio Bollerwagen",
    "src": "https://player.ffn.de/radiobollerwagen.mp3",
    "favorite": false
  },
  {
    "id": "a34db392-6362-4aba-92d8-a8c5b7f59ec0",
    "color": "#CC1033",
    "logo": "absolut_hot.png",
    "name": "Absolut Hot",
    "src": "https://edge67.live-sm.absolutradio.de/absolut-hot",
    "favorite": false
  },
  {
    "id": "2817dfdc-e4a7-4d8a-b586-1d99c3a1c733",
    "color": "#7A949E",
    "logo": "schwarzwaldradio.png",
    "name": "Schwarzwaldradio",
    "src": "https://edge59.streamonkey.net/fho-schwarzwaldradiohifi",
    "favorite": false
  },
  {
    "id": "ddfc49d6-5d7a-4128-bfd4-2b93a89a250c",
    "color": "#6A5F33",
    "logo": "https://www.technobase.fm/content/images/site/logo-technobase.fm.png",
    "name": "TechnoBase.FM",
    "src": "https://listen.technobase.fm/tunein-mp3",
    "favorite": false
  },
  {
    "id": "8d12e263-be73-412b-856b-6d8484313cf0",
    "color": "#FFDD00",
    "logo": "chari_vari.png",
    "name": "Chari Vari",
    "src": "https://live.stream.charivari.de/955charivari-webradio?aggregator=charivari_de_link",
    "favorite": false
  },
  {
    "id": "9c93f954-a5ce-4557-a32e-0cfb3f5d78cb",
    "color": "#014C6B",
    "logo": "chillout_antenne.png",
    "name": "Chillout Antenne",
    "src": "https://s5-webradio.antenne.de/chillout/stream/mp3",
    "favorite": false
  },
  {
    "id": "3428a55c-5215-4579-a1a9-86ca76ac56e4",
    "color": "#2C9BD3",
    "logo": "antenne_adria.png",
    "name": "Antenne Adria",
    "src": "https://antenne-adria.stream.laut.fm/antenne-adria",
    "favorite": false
  },
  {
    "id": "b442f2f4-239d-4d4a-ad12-3d22e9c6daa7",
    "color": "#104484",
    "logo": "wacken_radio.png",
    "name": "Wacken Radio",
    "src": "https://wacken.stream.laut.fm/wacken",
    "favorite": false
  },
  {
    "id": "f967d487-359b-4d50-9f79-4271ada52236",
    "color": "#167EBE",
    "logo": "radio_bob_mittelalter.png",
    "name": "Radio Bob Mittelalter",
    "src": "http://streams.radiobob.de/mittelalter/mp3-192/mediaplayer",
    "favorite": false
  },
  {
    "id": "58dca9c7-ac98-4c67-a990-93820fef186e",
    "color": "#FFE31B",
    "logo": "fluxfm.png",
    "name": "FluxFM",
    "src": "http://channels.fluxfm.de/FluxFM/stream.mp3",
    "favorite": false
  },
  {
    "id": "e7e872db-bfb8-47f7-b535-9f46a354ae5b",
    "color": "#BC941F",
    "logo": "blasmusik_radio.png",
    "name": "Blasmusik Radio",
    "src": "https://stream.laut.fm/blasmusikradio",
    "favorite": false
  }
]
